type,modifier,question
questions,Are,are health care premiums tax deductible
questions,Are,are health care costs tax deductible
questions,Are,are health care premiums pre tax
questions,Are,are health care benefits taxable
questions,Are,are health care expenses tax deductible
questions,Are,are health care costs rising
questions,Are,are health care funds a good investment
questions,Are,are health care spending accounts worth it
questions,Can I,can i use health care card for dental
questions,Can I,can i deduct health care expenses
questions,Can I,can i get health care card
questions,Can I,can health care premiums be deducted on taxes
questions,Can I,can health care assistants give injections
questions,Can I,can health care assistant sign passport
questions,Can I,can health care
questions,Can I,can i get a health care card at 65
questions,Can,can health care proxy override dnr
questions,Can,can health care premiums be deducted on taxes
questions,Can,can health care be free
questions,Can,can health care costs be deducted on taxes
questions,Can,can health care assistant administer medication
questions,Can,can healthcare workers get pfizer vaccine
questions,Can,can healthcare workers get second dose
questions,Can,can healthcare workers get pfizer
questions,How do,how do health care deductibles work
questions,How do,how do health care tax credits work
questions,How do,how do health care subsidies work
questions,How do,how do health care spending accounts work
questions,How do,how do health care savings plans work
questions,How do,how do health care costs affect the economy
questions,How do,how do health care fsa work
questions,How do,how do health care practitioners safeguard themselves
questions,How,how health care works
questions,How,how health care system works in us
questions,How,how health care can be improved
questions,How,how health care workers communicate about clients
questions,How,how health care system works in india
questions,How,how healthcare workers register for covid vaccine
questions,How,how healthcare works in canada
questions,How,how health care system in india divided
questions,Should I,should health care be free
questions,Should I,should health care be a human right
questions,Should I,should health care be a right or a privilege
questions,Should I,should health care be universal
questions,Should I,should health care be free for everyone
questions,Should I,should health care be free essay
questions,Should I,should i use va health care
questions,Should I,should i enroll in health care fsa
questions,Should,should healthcare be free
questions,Should,should healthcare be a human right
questions,Should,should health care be a right
questions,Should,should health care be a right or a privilege
questions,Should,should health care be free in america
questions,Should,should health care coverage be mandatory for employers
questions,Should,should healthcare be universal
questions,Should,should healthcare workers be vaccinated
questions,What,what health career is right for me
questions,What,what health careers do i want to explore
questions,What,what health care does starbucks offer
questions,What,what health care does the us have
questions,What,what health care provider means
questions,What,what healthcare reform
questions,What,what health careers are in demand
questions,What,what health career should i pursue
questions,When,when health care insurers negotiate contracts
questions,When,when health care agencies offer services
questions,Where are,where is health care free
questions,Where are,where is health care
questions,Where are,what country is healthcare free
questions,Where are,where in the world is healthcare free
questions,Where is,where is healthcare free
questions,Where is,where is healthcare services group located
questions,Where is,where is healthcare not free
questions,Where is,where is healthcare going
questions,Where is,where is healthcare free in the world
questions,Where is,where is healthcare the most expensive
questions,Where is,where is healthcare headed
questions,Where is,where is healthcare a right
questions,Where,when health care is
questions,Where,where is health care free
questions,Where,where is universal health care
questions,Where,where is providence health care
questions,Where,where is ramsay health care
questions,Where,where is stanford health care
questions,Where,where is primary health care
questions,Where,where is aurora health care
questions,Which,which health care plan is the best
questions,Which,which health career is best for me
questions,Which,which health care agency is considered private
questions,Which,which health care plan should i choose
questions,Which,which health care system is the best
questions,Which,which health care worker is displaying ageism
questions,Which,which health career is right for me
questions,Which,which health plan is best
questions,Who,who health care rankings
questions,Who,who health care rankings 2020
questions,Who,who health care policy
questions,Who,who health care ratings by country
questions,Who,who health care system
questions,Who,who health care system building blocks
questions,Who,who health care associated infections
questions,Who,who health care waste
questions,Why,why healthcare
questions,Why,why healthcare should be free
questions,Why,why healthcare is a human right
questions,Why,why healthcare should not be free
questions,Why,why healthcare is important
questions,Why,why healthcare is not a right
questions,Why,why health care costs are so high
questions,Why,why health care should be for everyone
questions,Will,will health care workers get a raise
questions,Will,will health care proxy
questions,Will,will health care workers get student loan forgiveness
questions,Will,will health care workers be required to get vaccine
questions,Will,will health care workers get a stimulus
questions,Will,will health care costs continue to rise
questions,Will,will health care workers have to get the vaccine
questions,Will,will health care workers get covid vaccine
in the past,Did,when did health care become for profit
in the past,Did,when did health care start
in the past,Did,when did health care start in canada
in the past,Did,when did health care reform start
in the past,Did,why did health care reform fail
in the past,Did,why did health care stocks drop today
in the past,Did,when did health care costs begin to rise
in the past,Did,how did health care begin
in the past,Was,is health care free
in the past,Was,is health care affordable
in the past,Was,is health care universal
in the past,Was,private healthcare
in the past,Was,is health care delivery system
in the past,Was,is health care secondary
in the past,Was,is health care directive
in the past,Was,is health care provider
comparisons,And,health care and education reconciliation act
comparisons,And,health care and social assistance
comparisons,And,health care and politics
comparisons,And,health care and family services
comparisons,And,health care and rehabilitation services
comparisons,And,health care and technology
comparisons,And,health care and rehab of sanford
comparisons,And,health care and privacy part 2
comparisons,Compared,health care compared around the world
comparisons,Compared,us health care compared to other countries
comparisons,Compared,canadian health care compared to united states
comparisons,Compared,canada health care compared to us
comparisons,Compared,sweden health care compared to us
comparisons,Compared,french health care compared to us
comparisons,Compared,health care systems compared
comparisons,Compared,canadian health care compared to other countries
comparisons,Like,what was health care like before the nhs
comparisons,Like,what is healthcare like in canada
comparisons,Like,what is healthcare like in china
comparisons,Like,what was health care like before the aca
comparisons,Like,what is healthcare like in italy
comparisons,Like,what is healthcare like in costa rica
comparisons,Like,what is healthcare like in mexico
comparisons,Like,what is healthcare like in spain
comparisons,Or,health care or healthcare
comparisons,Or,health care organizations
comparisons,Or,health care oregon
comparisons,Or,health care or healthcare ap style
comparisons,Or,health care organizations near me
comparisons,Or,http://healthcare.org
comparisons,Or,health care organizations may be owned by
comparisons,Or,health care originals
comparisons,Similar,health care services similar words
comparisons,Similar,health care system similar words
comparisons,Similar,health care provider similar words
comparisons,Similar,health care professions are similar
comparisons,Similar,similar healthcare companies
comparisons,Similar,similar health care facilities
comparisons,Versus,health care versus healthcare
comparisons,Versus,health care versus community acquired pneumonia
comparisons,Versus,health care versus life expectancy
comparisons,Versus,health care versus medicare
comparisons,Versus,health versus healthcare
comparisons,Versus,home health care versus hospice
comparisons,Versus,health care proxy versus power of attorney
comparisons,Versus,canadian health care versus american
comparisons,Vs,health care vs healthcare
comparisons,Vs,healthcare vs health insurance
comparisons,Vs,health care vs medical care
comparisons,Vs,health care vs healthcare ap style
comparisons,Vs,health care vs public health
comparisons,Vs,health care vs sick care
comparisons,Vs,healthcare vs
comparisons,Vs,health care vs medicare
prepositions,Can,health care canada
prepositions,Can,health care canada vs usa
prepositions,Can,health care canada vs us
prepositions,Can,health care canada history
prepositions,Can,health care canada vs australia
prepositions,Can,health care canadore
prepositions,Can,health care canada covid
prepositions,Can,health care canada jobs
prepositions,For,health care for the homeless
prepositions,For,health care for women
prepositions,For,health care for all
prepositions,For,health care for children
prepositions,For,health care for unemployed
prepositions,For,health care for undocumented immigrants
prepositions,For,health care for self employed
prepositions,For,health care for college students
prepositions,Is,healthcare issues
prepositions,Is,health care is a human right
prepositions,Is,healthcare issues in america
prepositions,Is,health care is a right
prepositions,Is,health care issues 2021
prepositions,Is,health care is not a right
prepositions,Is,healthcare issues in the united states
prepositions,Is,health care is too expensive
prepositions,Near,health care near me
prepositions,Near,health care nearby
prepositions,Near,health care near me no insurance
prepositions,Near,health care near me covid testing
prepositions,Near,home health care near me
prepositions,Near,primary health care near me
prepositions,Near,healthcare jobs near me
prepositions,Near,health care center near me
prepositions,To,healthcare topics
prepositions,To,health care today
prepositions,To,health care to you
prepositions,To,health care tools
prepositions,To,health care tourism
prepositions,To,health care to you insurance
prepositions,To,health care tools and equipment
prepositions,To,health care topics to write about
prepositions,With,health care without harm
prepositions,With,health care without walls
prepositions,With,health care without insurance
prepositions,With,healthcare with heart
prepositions,With,health care without insurance near me
prepositions,With,health care without a job
prepositions,With,health care without harm boston
prepositions,With,health care without harm jobs
prepositions,Without,health care without harm
prepositions,Without,health care without walls
prepositions,Without,health care without insurance
prepositions,Without,health care without insurance near me
prepositions,Without,health care without a job
prepositions,Without,health care without harm boston
prepositions,Without,health care without harm jobs
prepositions,Without,health care without walls boston
letters,a,health care administrator
letters,a,health care administrator salary
letters,a,health care academy
letters,a,health care authority
letters,a,health care associates
letters,a,health care agency
letters,a,health care administrator jobs
letters,a,healthcare administration
letters,b,health care blue book
letters,b,health care business
letters,b,health care benefits
letters,b,health care broker
letters,b,health care blue book free
letters,b,health care bill
letters,b,health care business plan pdf
letters,b,health care business integrity guide
letters,c,health care center
letters,c,health care clinic
letters,c,health care coverage
letters,c,health care credit union
letters,c,health care cost
letters,c,health care clinic near me
letters,c,healthcare careers
letters,c,health care center near me
letters,d,health care district
letters,d,health care directive
letters,d,health care definition
letters,d,health care department
letters,d,health care discounts
letters,d,health care directive form
letters,d,health care disparities
letters,d,health care district of palm beach
letters,e,health care express
letters,e,health care etf
letters,e,health care exchange
letters,e,health care express texarkana
letters,e,health care equipment
letters,e,health care equity
letters,e,healthcare ethics
letters,e,health care express marshall tx
letters,f,health care fsa
letters,f,health care flexible spending account
letters,f,health care for the homeless
letters,f,health care facilities
letters,f,health care for women
letters,f,health care for all
letters,f,health care first
letters,f,health care family credit union
letters,g,healthcare gov
letters,g,health care guardian name
letters,g,health care group
letters,g,health care grants
letters,g,health care goals and objectives examples
letters,g,health care group services
letters,g,health care guardian
letters,g,health care giant with violet heart
letters,h,health care home
letters,h,healthcare hero
letters,h,health care hospital
letters,h,healthcare highways
letters,h,health care home program
letters,h,health care healthcare
letters,h,health care hawaii
letters,h,health care hsa
letters,i,health care insurance
letters,i,health care insurance plans
letters,i,health care informatics
letters,i,healthcare issues
letters,i,health care in the united states
letters,i,healthcare industry
letters,i,health care in canada
letters,i,health care institute
letters,j,healthcare jobs
letters,j,health care jobs near me
letters,j,health care jobs hiring near me
letters,j,health care jobs for college students
letters,j,health care jokes
letters,j,health care jobs from home
letters,j,health care jobs with no experience
letters,j,health care journals
letters,k,health care kaiser
letters,k,health care kentucky
letters,k,health care knowledge
letters,k,health care king mattress
letters,k,health care kit for newborns
letters,k,health care kickbacks
letters,k,health care ky
letters,k,health care kansas
letters,l,health care logistics
letters,l,health care la
letters,l,health care law
letters,l,health care logistics inc
letters,l,health care lawyer
letters,l,health care logistics catalog
letters,l,health care license
letters,l,health care logo
letters,m,health care marketplace
letters,m,healthcare management
letters,m,health care manager salary
letters,m,health care marketplace phone number
letters,m,health care meaning
letters,m,health care mattress
letters,m,health care management programs
letters,m,health care ministry
letters,n,health care near me
letters,n,health care network
letters,n,health care navigator
letters,n,health care news
letters,n,health care now
letters,n,health care navigator llc
letters,n,health care number
letters,n,health care nj
letters,o,health care options
letters,o,health care or healthcare
letters,o,health care organizations
letters,o,health care one
letters,o,health care options phone number
letters,o,health care open enrollment 2021
letters,o,health care of nevada
letters,o,health care options california
letters,p,health care privacy part 2
letters,p,health care proxy
letters,p,health care provider
letters,p,health care privacy part 1
letters,p,health care privacy part 5
letters,p,health care privacy part 3
letters,p,health care proxy form
letters,p,health care power of attorney
letters,q,health care quality
letters,q,health care quotes
letters,q,health care quality improvement act
letters,q,health care quality by state
letters,q,health care questions
letters,q,health care quality certifications
letters,q,health care quality by country
letters,q,health care quiz
letters,r,healthcare reform
letters,r,healthcare reform act
letters,r,health care reimbursement account
letters,r,health care registry
letters,r,health care resource centers
letters,r,health care rankings by country
letters,r,health care reit
letters,r,health care representative
letters,s,health care service corporation
letters,s,health care solutions
letters,s,health care surrogate
letters,s,health care services
letters,s,health care system
letters,s,health care stocks
letters,s,healthcare service group
letters,s,health care spending account
letters,t,health care tax credit
letters,t,health care technician
letters,t,healthcare team
letters,t,healthcare technology
letters,t,health care training
letters,t,healthcare trends
letters,t,health care technologies
letters,t,health care temp agency
letters,u,health care unlimited
letters,u,health care united
letters,u,health care utilization
letters,u,health care usa
letters,u,health care unemployed
letters,u,health care urgent care
letters,u,health care unit coordinator
letters,u,health care union
letters,v,health care vs healthcare
letters,v,health care vaccine
letters,v,health care volunteering
letters,v,health care vaccine mandate
letters,v,health care volunteering near me
letters,v,health care vision statement examples
letters,v,healthcare vs health insurance
letters,v,health care vaccine mandate oregon
letters,w,health care workers
letters,w,health care workers vaccine
letters,w,health care worker vaccine mandate
letters,w,health care workers not vaccinated
letters,w,health care worker registry
letters,w,health care workers vaccine mandate oregon
letters,w,health care workers discounts
letters,w,health care workers must be vaccinated
letters,x,health care xpress
letters,x,health care center
letters,x,health care clinic
letters,x,health care coverage
letters,x,health care credit union
letters,x,health care clinic near me
letters,x,healthcare careers
letters,x,health care center near me
letters,y,health care yuma az
letters,y,health care youtube
letters,y,health care youtube channel
letters,y,health care yukon
letters,y,health care yogi nagar
letters,y,health care yellowknife
letters,y,health care yemen
letters,y,health care york
letters,z,health care zoom
letters,z,health care zone
letters,z,health care zones bc
letters,z,health care zero
letters,z,health care new zealand
letters,z,v3 healthcare zone
letters,z,home health care zanesville ohio
letters,z,aurora health care zion
query,Health care,health care privacy part 2
query,Health care,health care proxy
query,Health care,http://healthcare.gov
query,Health care,health care marketplace
query,Health care,health care provider
query,Health care,health care privacy part 1
query,Health care,health careers
query,Health care,health care insurance
